{
  "$schema": "./architecture/schemas/titmas-cs-d02-pre70-explicit-docker-host-and-global-config-guard-decision-record.schema.v0.1.json",
  "document_id": "DBA-TITMAS-CS-D02-PRE-70-EXPLICIT-DOCKER-HOST-AND-GLOBAL-CONFIG-GUARD-DECISION-0.1",
  "version": "0.1.0",
  "status": "EXACT_NONACTIVATING_COLIMA_RERUN_AUTHORIZED_NOT_EXECUTED",
  "decision_id": "CS-D02-PRE-70",
  "standing_directive_reference": "TITMAS-CS-STANDING-001",
  "recommendation_reference": "TITMAS-CS-D02-PRE-70-EXPLICIT-DOCKER-HOST-AND-GLOBAL-CONFIG-GUARD-RECOMMENDATION-v0.1.md",
  "recommendation_sha256": "34c622f03f493b774f4ccb0b00f646aac9810ca0810d9121d1c1a623ade6b4f8",
  "recommendation_commit": "ff0c7dd93f250ef65c300b2913de2fbce708c9cc",
  "scope_reference": "commercialization-standards-p0-security-and-platform-context-remediation/pre70-context-and-config-guard-scope.v0.1.json",
  "scope_sha256": "be159d945c02cb0f3a17d87dd1aa351d4fd6c7b270a3a14fe1085c285956f077",
  "scope_schema_sha256": "9714b064974937431dd6f705ef2f4b6df58eacb421861214e4e9538e31acfd7d",
  "decision_result": "AUTHORIZE_ONE_NONACTIVATING_COLIMA_RERUN_WITH_EPHEMERAL_DOCKER_CONFIG_EXPLICIT_DOCKER_HOST_METADATA_GUARD_THEN_EXISTING_PLATFORM_AND_AGENT_LANES",
  "decided_by_ref": "zhangbin",
  "decided_at": "2026-07-27T13:48:55+08:00",
  "executed_by": "Codex",
  "standing_directive_eligibility": {
    "canonical_recommendation_present": true,
    "single_exact_option": true,
    "target_scope_and_control_delta_explicit": true,
    "pre69_failure_directly_evidenced": true,
    "runtime_network_api_and_cleanup_exactly_bounded": true,
    "all_effect_classes_declared": true,
    "stop_conditions_explicit": true,
    "later_conflict_present": false,
    "independent_decision_record_present": true,
    "result_validation_and_failure_retention_required": true,
    "material_actions_separately_recorded": true,
    "applicable": true
  },
  "preconditions": {
    "recommendation_remote_verified": true,
    "recommendation_commit": "ff0c7dd93f250ef65c300b2913de2fbce708c9cc",
    "pre69_failure_retained": true,
    "pre69_retry_authorized": false,
    "pre70_is_new_authorization": true,
    "target_commit": "0030077f29c37145a306b72e7083345eb76b504a",
    "target_remote_branch_matched": true,
    "target_dirty_count": 0,
    "review_input_hashes_matched": 10,
    "review_input_hashes_expected": 10,
    "colima_version": "0.10.1",
    "nonactivating_flag_available": true,
    "save_config_flag_available": true,
    "docker_host_option_available": true,
    "qianfan_credential_identifier_configured": true,
    "dashscope_credential_identifier_configured": true,
    "credential_values_recorded": false,
    "colima_initial_state": "NOT_RUNNING"
  },
  "scope": {
    "primary_repository": "digital-biosphere-architecture",
    "target_repository": "https://github.com/joy7758/titmas-integrations.git",
    "target_branch": "codex/rb0-governance-baseline",
    "target_commit": "0030077f29c37145a306b72e7083345eb76b504a",
    "execution_plan_reference": "commercialization-standards-p0-security-and-platform-context-remediation/execution-plan.v0.1.json",
    "temporary_roots_max": 1,
    "local_source_exports_max": 1,
    "anonymous_config_copies_max": 1,
    "global_config_metadata_snapshot_pairs_max": 1,
    "container_runtime_starts_max": 1,
    "image_pull_attempts_max": 2,
    "container_runs_max": 2,
    "agent_model_requests_max": 2,
    "concurrency_max": 1,
    "timeout_seconds_per_request": 120,
    "retry_max": 0,
    "fallback_max": 0,
    "model_substitution_max": 0,
    "json_repair_max": 0,
    "user_docker_config_direct_writes_max": 0,
    "user_docker_config_repairs_max": 0,
    "credential_value_reads_max": 0,
    "target_writes_max": 0,
    "target_network_calls_max": 0,
    "p1_or_p2_executions_max": 0,
    "provider_binding_actions_max": 0,
    "release_actions_max": 0
  },
  "authorization": {
    "ephemeral_temp_root_creation_authorized": true,
    "local_exact_commit_source_export_authorized": true,
    "anonymous_template_copy_authorized": true,
    "metadata_only_global_config_guard_authorized": true,
    "nonactivating_existing_colima_start_authorized": true,
    "explicit_colima_docker_host_binding_authorized": true,
    "two_exact_public_digest_pulls_authorized": true,
    "two_network_none_read_only_container_runs_authorized": true,
    "two_exact_agent_review_requests_authorized": true,
    "two_exact_credential_identifier_reads_authorized": true,
    "ephemeral_temp_root_cleanup_authorized": true,
    "result_artifact_writes_in_primary_repository_authorized": true,
    "user_docker_config_direct_write_authorized": false,
    "user_docker_config_repair_authorized": false,
    "credential_value_recording_authorized": false,
    "target_repository_write_authorized": false,
    "real_network_test_authorized": false,
    "p1_or_p2_execution_authorized": false,
    "provider_binding_authorized": false,
    "formal_human_security_review_authorized": false,
    "contract_adoption_authorized": false,
    "merge_authorized": false,
    "release_authorized": false
  },
  "effects_before_execution": {
    "global_docker_config_changed": false,
    "target_repository_changed": false,
    "platform_validations_executed": false,
    "agent_reviews_executed": false,
    "provider_supported": false,
    "formal_human_security_review_complete": false,
    "contract_adopted_as_standard": false,
    "cross_platform_support_proven": false,
    "real_network_conformance_proven": false,
    "runtime_created_as_product": false,
    "agent_created": false,
    "entity_created": false,
    "permission_created": false,
    "release_authorized": false,
    "standard_ready": false
  },
  "rollback": {
    "stop_colima_with_ephemeral_docker_config_if_started": true,
    "delete_only_pre70_ephemeral_temp_root": true,
    "user_docker_config_cleanup_allowed": false,
    "image_cache_cleanup_authorized": false,
    "history_rewrite_allowed": false,
    "force_push_allowed": false,
    "failed_partial_and_boundary_results_retained": true
  },
  "next_gate": {
    "gate_id": "CS-D02-PRE-70-EXECUTION",
    "action": "EXECUTE_ONE_NONACTIVATING_EXPLICIT_DOCKER_HOST_RERUN_FAIL_CLOSED",
    "formal_human_security_review_decision_allowed": false,
    "contract_adoption_decision_allowed": false,
    "release_decision_allowed": false
  },
  "result": "NOT_EXECUTED"
}
